1374,「先生は癇性ですね」とかつて奥さんに告げた時、奥さんは「でも着物などは、それほど気にしないようですよ」と答えた事があった。,着物,"When I once remarked to his wife that he was sensitive, she replied,”But he does not trouble himself about his dress.”",0.6674745679,,his dress,Generalization,最小化,原文「着物」を「his dress」と一般化することで、日本文化の衣服の差異を普遍的な「服装」に収束させ、文化差を最小化している。
1381,「お目出とう」といって、先生が私のために杯を上げてくれた。私はこの盃に対してそれほど嬉しい気を起さなかった。,盃,"“ Congratulations,” the sensei said, and raised  his cup to me.These words did not produce the desired effect.",0.6833930016,,cup,Generalization,最小化,原文「盃」を「cup」と一般化することで、特定の酒器としての日本文化の差異を、普遍的な容器という概念に収束（最小化）させている。
1381,「お目出とう」といって、先生が私のために杯を上げてくれた。私はこの盃に対してそれほど嬉しい気を起さなかった。,杯,"“ Congratulations,” the sensei said, and raised  his cup to me.These words did not produce the desired effect.",0.6833930016,,cup,Generalization,最小化,原文「杯」を「cup」という一般的な飲み物を入れる容器に一般化し、日本特有の酒器の文化的差異を普遍的な概念に収束（最小化）させている。
1405,奥さんは下女を呼んで食卓を片付けさせた後へ、改めてアイスクリームと水菓子を運ばせた。,アイスクリーム,"She called the maid, who cleared away the table,  and brought ice-cream and fruit instead.",0.7560925484,,ice-cream,Established equivalent,最小化,「アイスクリーム」を「ice-cream」と定着した等価表現で訳すことで、両文化に共通する普遍的な食品概念として提示し、文化差を最小化している。
1405,奥さんは下女を呼んで食卓を片付けさせた後へ、改めてアイスクリームと水菓子を運ばせた。,水菓子,"She called the maid, who cleared away the table,  and brought ice-cream and fruit instead.",0.7560925484,,fruit,Generalization,最小化,原文「水菓子」を「fruit」と一般化することで、日本特有の食文化の差異を、より普遍的なデザートの概念に収束させ、文化差を最小化している。
1488,先生は手に持った団扇をわざとばたばたいわせた。そうしてまた奥さんを顧みた。,団扇,"He purposely flapped the fan in his hand, and turned to his wife again.",0.5805693865,,fan,Generalization,最小化,「団扇」を「fan」という一般的な語に一般化することで、日本特有の文化的な道具を普遍的な概念に収束させ、文化差を最小化している。
1493,「古本屋に売るさ」,古本屋,You can sell them to a second-hand book seller.,0.5679597259,,second-hand book seller,Established equivalent,最小化,「古本屋」を「second-hand book seller」という定着した等価表現で訳し、日本固有の商業形態を普遍的な中古本販売の概念に収束させ、文化差を最小化している。
1500,縁喜でもない。,縁起,Please don't do it any more.,0.6846907139,,Please don't do it any more.,Modulation,適応,「縁起」が持つ「行為中止を促す」意図を「Please don't do it any more.」と変調し、ターゲット読者が機能的に理解できるよう適応させている。
1505,玄関と門の間にあるこんもりした木犀の一株が、私の行手を塞ぐように、夜陰のうちに枝を張っていた。,木犀,"The dense fragrant olive between the entrance-door and the gate stretched its branches in the dark, as if trying to block my way.",0.7389726043,,fragrant olive,Established equivalent,最小化,原文「木犀」を「fragrant olive」と定着した等価表現で訳し、日本固有の植物としての文化差を普遍的な植物名に収束させ、最小化している。
1523,私は電車の中で汗を拭きながら、他の時間と手数に気の毒という観念をまるでもっていない田舎者を憎らしく思った。,田舎者,"Wiping my perspiring face in the  electric-car, I hated those countrymen who did not feel a bit sorry for taking my time and troubling me so much.",0.6790159941,,countrymen,Established equivalent,最小化,原文「田舎者」を「countrymen」という定着した等価表現で訳し、日本固有の文化的含意を、両文化に共通する一般的な地方出身者という概念に収束させ、文化差を最小化している。
1527,それを履行するに必要な書物も手に入れなければ、ならなかった。私は半日を丸善の二階で潰す覚悟でいた。,丸善,"In order to carry out my program me I had to get some necessary books, and I resolved to spend half a day on the first floor of Maruzen.",0.580609858,,Maruzen,Borrowing,受容,原文「丸善」を「Maruzen」と借用し、日本の固有の書店名という文化差をそのまま提示することで、読者にその存在の受容を求めている。
