425,日光へ行った時は紅葉の葉を一枚封じ込めた郵便も貰った。,紅葉,"With trembling hands, I folded the letter and  put it into the envelope.",0.5482595563,,なし,Reduction,否認,原文の「紅葉」という文化的要素が訳文で完全に削除されており、翻訳者が文化差の存在を否認している。
429,先生の宅は玄関の次がすぐ座敷になっているので、格子の前に立っていた私の耳にその言逆いの調子だけはほぼ分った。,格子,"As the drawing-room in his house  was next to the entrance-hall, my ears could catch  the voices clearly enough to detect their sharpness, though I stood outside of the entrance-door.",0.729026258,,なし,Reduction,否認,原文「格子」に対応する語句が訳文から完全に削除されており、日本家屋特有の文化的要素が消失しているため、文化差の存在を否認している。
437,私は帰ったなりまだ袴を着けていた。私は～～表へ出た。,袴,"I still wore my hakama, so I went out at once.",0.633903563,hakama:  A kind of kilt worn by students.,hakama,Amplification,適応,「袴」を「hakama」と借用し、注釈（増幅）で「kilt worn by students」と機能的に説明を加えることで、読者が日本文化の衣類の機能的役割を理解できるよう適応させている。
438,私は帰ったなり～～着けていた。私はそれなりすぐ表へ出た。,表,"I still wore my hakama, so I went out at once.",0.7262793779,hakama:  A kind of kilt worn by students.,なし,Reduction,否認,訳文では「表」という特定の場所を示す情報が完全に削除されており、文化的要素およびその機能が消失しているため、文化差の存在を否認している。
443,肴の骨が咽喉に刺さった時のように、私は苦しんだ。,魚の骨が喉に刺さった時のように,It tortured me like a fish-bone stuck in my throat.,0.8347236514,,like a fish-bone stuck in my throat,Established equivalent,最小化,この比喩表現を定着した等価表現で訳すことで、両文化に共通する身体的苦痛の普遍性を強調し、文化差を最小化している。
462,「そういうと、夫の方はいかにも心丈夫のようで少し滑稽だが。,心丈夫,It hardly seems right for me to speak like this.,0.7180389166,,なし,Reduction,否認,原文の「心丈夫」が表す夫の安心感という情報が、訳文では完全に削除されており、この文化要素の存在を否認（無視）している。
489,先生はその日横浜を出帆する汽船に乗って外国へ行くべき友人を新橋へ送りに行って留守であった。,横浜,The sensei had gone out to Shinbashi to see a friend  off who was going abroad by the steamer which was  to leave Yokohama that day.,0.6437929869,,Yokohama,Borrowing,受容,原文「横浜」を「Yokohama」と借用し、日本の固有名詞としての文化的差異をそのまま提示することで、読者にその存在を受容するよう求めている。
489,先生はその日横浜を出帆する汽船に乗って外国へ行くべき友人を新橋へ送りに行って留守であった。,新橋,The sensei had gone out to Shinbashi to see a friend  off who was going abroad by the steamer which was  to leave Yokohama that day.,0.6437929869,,Shinbashi,Borrowing,受容,原文「新橋」を「Shinbashi」と借用し、日本の固有の地名をそのまま提示することで、読者にその存在の受容を促している。
494,それで私は座敷へ上がって、先生を待つ間、奥さんと話をした。,座敷,So I had a talk with his wife while I waited in his drawing-room.,0.6589087248,,drawing-room,Adaptation,適応,原文「座敷」を「drawing-room」と訳すことで、日本固有の空間の機能（応接間）をターゲット文化の機能的等価物に置き換え、読者が違和感なく理解できるよう適応させている。
504,だから先生の学問や思想については、先生と密切の関係をもっている私より外に敬意を払うもののあるべきはずがなかった。,敬意,"I, who had come into close contact with him, seemed to be the only one who had either knowledge of or respect for his learning or his ideas.",0.6611660719,,respect,Established equivalent,最小化,原文「敬意」を「respect」という定着した等価表現で訳し、日本語特有の敬意表現を普遍的な概念に収束させ、文化差を最小化している。
507,私にはその答えが謙遜過ぎてかえって世間を冷評するようにも聞こえた。,謙遜,"To me that answer was too modest, until I realized that it showed his cold critical attitude toward the world.",0.6817296743,,modest,Established equivalent,最小化,「謙遜」を「modest」という定着した等価語で訳し、日本語特有の謙遜文化を普遍的な「控えめさ」に収束させ、文化差を最小化している。
531,奥さんは東京の人であった。,東京,I heard from both the sensei and his wife that she was a native of Tokyo.,0.7470892072,,Tokyo,Borrowing,受容,原文「東京」を「Tokyo」と借用し、日本の地名としての文化的固有性をそのまま提示することで、読者にその存在を受容するよう促している。
533,奥さんの父親はたしか鳥取かどこかの出であるのに、お母さんの方はまだ江戸といった時分の市ヶ谷で生れた女なので、奥さんは冗談半分そういったのである。,鳥取,"For her father had come from Tottori, as I remember, while her mother was born in Ichigaya when Tokyo was still called Edo.",0.5883220434,,Tottori,Borrowing,受容,原文「鳥取」を「Tottori」と借用し、日本の地名としての文化的固有性をそのまま維持することで、読者にその差異の認識と受容を求めている。
533,奥さんの父親はたしか鳥取かどこかの出であるのに、お母さんの方はまだ江戸といった時分の市ヶ谷で生れた女なので、奥さんは冗談半分そういったのである。,江戸,"For her father had come from Tottori, as I remember, while her mother was born in Ichigaya when Tokyo was still called Edo.",0.5883220434,,Edo when Tokyo was still called Edo,Amplification,適応,「江戸」を「Edo」と借用しつつ、「when Tokyo was still called Edo」と原文にない「Tokyo」情報で補足（増幅）することで、ターゲット読者が「江戸」の歴史的機能を理解できるよう適応させている。
535,ところが先生は全く方角違いの新潟県人であった。,新潟県人,"But the sensei's home was Niigata, a province far away from either Tottori or Tokyo.",0.606446147,,Niigata,a province,Amplification,"適応,「新潟県人」を「Niigata, a province」と地名と行政区分を増幅して説明し、読者が文化要素の機能を地理的情報として機能的に理解できるよう適応させている。"
553,或る時花時分に私は先生といっしょに上野へ行った。そうして～～カップルを見た。,花時分,"Once in spring-time I went with him to Ueno, and saw a charming couple walking close together under the cherry-blossoms.",0.6404955983,,in spring-time... under the cherry-blossoms,Particularization,統合,原文「花時分」が持つ日本の「桜の時期」という含意を「cherry-blossoms」と具体化し、さらにカップルの描写を組み合わせることで、花時分が持つ象徴的・ロマンチックな概念を読者に再構築して提示している。
563,君は今あの男と女を見て、 冷評 しましたね。あの 冷評 のうちには君が恋を求めながら相手を得られないという不快の声が 交っていましょ,冷評,"You spoke unsympathetically of that man and woman, didn't you? In those words of yours is mingled the voice of your unhappiness at not experiencing love when you are seeking for it. Don't you think so?",0.7844480276,,those words of yours,Generalization,最小化,原文「冷評」を「those words of yours」と一般化し、特定の「冷たい評価」という行為を、その媒体である「言葉」という普遍的な概念に収束させ、文化差を最小化している。
594,先生と私とは博物館の裏から鶯渓の方角に静かな歩調で歩いて行った。,鶯溪,The sensei and I walked slowly along from the back of the Imperial Museum toward Uguisudani.,0.5654426217,,Uguisudani,Borrowing,受容,原文「鶯渓」を「Uguisudani」と借用することで、日本の固有名詞としての文化的差異をそのまま提示し、読者にその地名の受容を求めている。
595,垣の隙間から広い庭の一部に茂る熊笹が幽邃に見えた。,垣,"The bamboo clumps covering a part of the garden could be seen through the hedge, looking solitary and mysterious.",0.663793087,,the hedge,Established equivalent,最小化,原文「垣」を「the hedge」と訳し、日本固有の多様な「垣」の様式を、ターゲット文化に馴染む普遍的な「庭の囲い」として最小化している。
595,垣の隙間から広い庭の一部に茂る熊笹が幽邃に見えた。,幽邃,"The bamboo clumps covering a part of the garden  could be seen through the hedge, looking solitary  and mysterious.",0.663793087,,solitary and mysterious,Modulation,統合,「幽邃」を「solitary and mysterious」と変調することで、奥深く静謐な日本独自の美的・象徴的な感覚を、英語圏の読者が理解しやすい複合的な概念として再構築し、文化を統合している。
595,垣の隙間から広い庭の一部に茂る熊笹が幽邃に見えた。,熊笹,"The bamboo clumps covering a part of the garden  could be seen through the hedge, looking solitary  and mysterious.",0.663793087,,bamboo clumps,Generalization,最小化,原文「熊笹」を「bamboo clumps」と一般化することで、特定の笹の種類としての差異を薄め、普遍的な「竹の茂み」という共通概念に収束させている。
597,「君は私がなぜ毎月雑司ヶ谷の墓地に埋っている友人の墓へ参るのか知っていますか」,雑司ヶ谷,"""Do you know the reason why I visit my friend's grave in Zoshigaya every month?""",0.7716242671,,Zoshigaya,Borrowing,受容,原文「雑司ヶ谷」を「Zoshigaya」と借用し、日本の具体的な地名をそのまま提示することで、読者にその文化的な存在を意識させ、受容を促している。
616,「私はお気の毒に思うのです」,お気の毒,"""I am sorry for you.""",0.8287933469,,sorry for you,Established equivalent,最小化,「お気の毒」を「sorry for you」という定着した等価表現で訳し、日本語特有の感情表現を普遍的な同情に収束させ、文化差を最小化している。
616,「気の毒だが信用されないとおっしゃるんですか」,気の毒,"""Is it true that you cannot trust me, and perhaps hesitate to say so ?""",0.8147552013,,なし,Reduction,否認,原文「気の毒だが」に対応する表現が訳文から完全に削除され、文化差の存在を否認（無視）している。
617,その庭に、この間まで重そうな赤い強い色をぽたぽた点じていた椿の花はもう一つも見えなかった。,椿の花,"The camellias, with their heavy strong red, had been in bloom when I was there before, but they were all gone now.",0.6152314544,,camellias,Established equivalent,最小化,原文「椿の花」を「camellias」という定着した等価語で訳し、日本語固有の植物を普遍的な植物概念に収束させ、文化的な差異を最小化している。
618,先生は座敷からこの椿の花をよく眺める癖があった。,座敷,The sensei had a habit of looking at them while he was talking in the drawing-room.,0.5680678487,,drawing-room,Adaptation,適応,原文「座敷」を「drawing-room」に置き換え、日本の伝統的空間の形態的差異をなくしつつ、機能的役割をターゲット読者が理解できるよう適応させている。
618,先生は座敷からこの椿の花をよく眺める癖があった。,椿の花,The sensei had a habit of looking at them while he was talking in the drawing-room.,0.5680678487,,them,Reduction,否認,原文「椿の花」という具体的な文化要素が代名詞「them」に削減されており、特定の文化情報が訳文から削除され、文化差を否認している。
620,その時生垣の向うで金魚売りらしい声がした。,生垣,"As he spoke, a voice which seemed to be a goldfish vendor's was heard from across the hedge.",0.5642588735,,the hedge,Established equivalent,最小化,「生垣」を「the hedge」という定着した等価語で訳し、日本固有の庭園要素としての特殊性を強調せず、普遍的な「垣根」という共通概念に収束（最小化）させている。
620,その時生垣の向うで金魚売りらしい声がした。,金魚売り,"As he spoke, a voice which seemed to be a goldfish vendor's was heard from across the hedge.",0.5642588735,,goldfish vendor,Calque,適応,「金魚売り」を「goldfish vendor」と語義的に直訳（カルク）し、日本的な行商人の機能をターゲット読者が理解できるよう適応させている。
624,黙って針仕事か何かしている奥さんの耳に私の話し声が聞こえるという事も知っていた。,針仕事,"I knew that my words could  be plainly heard by his wife, sitting in the next room,  busy with needle-work or some other feminine task.",0.7641642094,,needle-work or some other feminine task,Amplification,適応,原文「針仕事」を「needle-work or some other feminine task」と増幅し、奥さんの行為が「女性的な仕事」であると補足することで、読者が文化的機能を理解できるよう適応させている。
628,自分を呪うより外に仕方がないの,呪う,"The only thing that such a man can do, is to curse himself.",0.629938066,,curse,Established equivalent,最小化,原文「自分を呪う」の「呪う」を「curse」という定着した等価表現で訳し、日本語特有の強い自己否定の感情を、普遍的な人間の内面的な葛藤として提示し、文化差を最小化している。
632,すると襖の陰で「あなた」という奥さんの声が二度聞こえた。,襖の陰で,But just then we heard his wife calling him twice behind the sliding-doors.,0.6474490166,,behind the sliding-doors,Generalization,最小化,「襖の陰で」を「behind the sliding-doors」と訳すことで、「襖」という日本特有の建具を「sliding-doors」という一般的な「引き戸」に一般化し、文化固有の差異を普遍的な機能に最小化している。
676,その頃は日の詰って行くせわしない秋に、誰も注意を惹かれる肌寒の季節であった。,秋,"It was late autumn, and in these chilly days, no one could be indifferent to the atomosphere of bustle which attended the shortening day.",0.8380932808,,late autumn,Particularization,適応,「秋」を「late autumn」と具体化し、原文「日の詰まって行く」という季節の進行を訳語に反映させ、読者が機能的に理解できるよう適応している。
676,その頃は日の詰って行くせわしない秋に、誰も注意を惹かれる肌寒の季節であった。,肌寒い,"It was late autumn, and in these chilly days, no one could be indifferent to the atomosphere of bustle which attended the shortening day.",0.8380932808,,chilly days,Established equivalent,最小化,原文「肌寒い」を「chilly days」と訳し、日本語特有の軽い寒さの感覚を英語の普遍的な等価語に収束させ、文化差を最小化している。
693,私は畏まったまま烟草を飲んでいた。奥さん～～聞こえた。,煙草を飲む,"I remained in a formal attitude, smoking, and could hear the sensei's wife talking to the maid in the sitting-room.",0.7612641454,,smoking,Literal translation,最小化,原文「煙草を飲む」を「smoking」と直訳し、「飲む」という表現の文化差を普遍的な「喫煙」行為に収束させ、最小化している。
694,私は畏ま～～飲んでいた。奥さんが茶の間で何か下女に話している声が聞こえた。,茶の間,"I remained in a formal attitude, smoking, and could hear the sensei's wife talking to the maid in the sitting-room.",0.6034648418,,the sitting-room,Adaptation,最小化,「茶の間」を「the sitting-room」と置き換えることで、日本固有の生活空間の差異を隠蔽し、ターゲット文化にとって馴染み深く、機能的に共通する空間に収束させ、文化差を最小化している。
694,私は畏ま～～飲んでいた。奥さんが茶の間で何か下女に話している声が聞こえた。,下女,"I remained in a formal attitude, smoking, and could hear the sensei's wife talking to the maid in the sitting-room.",0.6034648418,,the maid,Established equivalent,最小化,原文「下女」を「the maid」という定着した等価語で訳すことで、日本特有の社会的役割を一般的な「使用人」に収束させ、文化差を最小化している。
700,「おや」といって～～私に向けた。そうして客に来た人のように鹿爪らしく控えている私をおかしそうに見た。,鹿爪らしく,"”Why,” she said, looking in, half surprised at me sitting formally like a guest. It seemed to appear ridiculous to her.",0.6826357841,,formally like a guest,Description,適応,「鹿爪らしく」を「formally like a guest」と形態・機能を記述することで、ターゲット読者がその行動の機能的意味を違和感なく理解できるよう適応させている。
709,私は奥さん～～書斎を出た。茶の間には綺麗な長火鉢に鉄瓶が鳴っていた。,長火鉢,"I followed her to the sitting-room, where an  iron tea-kettle was singing pleasantly on a beautifully  polished oblong brazier.",0.5557203889,,oblong brazier,Description,適応,「長火鉢」を「oblong brazier」と形態・機能を記述し、読者が日本の生活様式における機能を理解できるよう適応させている。
709,私は奥さん～～書斎を出た。茶の間には綺麗な長火鉢に鉄瓶が鳴っていた。,鉄瓶,"I followed her to the sitting-room, where an  iron tea-kettle was singing pleasantly on a beautifully  polished oblong brazier.",0.5557203889,,an iron tea-kettle,Calque,適応,「鉄瓶」を「an iron tea-kettle」と語義的に直訳（カルク）し、その素材と機能を示すことで、ターゲット読者が違和感なく機能的役割を理解できるよう適応させている。
724,空の盃でよくああ飽きずに献酬ができると思いますわ,空の盃,I wonder why they don’t get tired offering and taking quite empty cups.,0.5077880621,,empty cups,Literal translation,最小化,「空の盃」を「empty cups」と直訳することで、「盃」という日本独自の酒器の概念を「cup」という普遍的な食器に置き換え、文化差を普遍的な「器」の概念に収束（最小化）させている。
724,空の盃でよくああ飽きずに献酬ができると思いますわ,献酬,I wonder why they don’t get tired offering and taking quite empty cups.,0.5077880621,,offering and taking,Generalization,最小化,原文「献酬」を「offering and taking」という一般的な行為に一般化することで、日本固有の酒席の儀礼としての文化差を薄め、普遍的な動作として提示（最小化）している。
773,けれどもそれは懐かしい春の雲を眺めるような心持で、ただ漠然と夢みていたに過ぎなかった。,春の雲,"But it was like the feeling  which takes possession of us when we look upon  the lovely clouds of spring, a mere indefinite longing.",0.7555196881,,clouds of spring,Literal translation,受容,原文「春の雲」を「clouds of spring」と直訳し、日本の季節感を含む情景描写をそのまま提示することで、読者にその文化差の受容を求めている。
792,下女部屋にいる下女はことりとも音をさせなかった。私は～～忘れてしまった。,下女部屋,"No sound was heard from the maid in the servant's room, and the thought of the thief had disappeared entirely from my mind.",0.6976799965,,servant's room,Literal translation,最小化,「下女部屋」を「servant's room」と直訳することで、日本固有の空間概念を「使用人の部屋」という普遍的な機能に収束させ、文化差を最小化している。
798,奥さんは～～掻き馴らせた。それから水注の水を鉄瓶に注した。鉄瓶は忽ち鳴りを沈めた。,鉄瓶,"She levelled the ashes in the brazier, and poured  water into the iron kettle, which stopped singing at  once.",0.5969341993,,iron kettle,Literal translation,最小化,「鉄瓶」を「iron kettle」と直訳することで、日本文化固有の工芸品としての側面は薄められ、湯沸かし器という普遍的な機能に収束（最小化）させている。
858,下女だけは仮寝でもしていたとみえて、ついに出て来なかった。,下女,"The maid did not appear, she must have been dozing in her room.",0.665410161,,The maid,Established equivalent,最小化,原文「下女」を「the maid」という定着した等価表現で訳すことで、日本固有の歴史的・社会的な背景を含む「下女」の文化差を、両文化に共通する「家事使用人」というより普遍的な概念に収束（最小化）させている。
871,奥さんはそういいながら、先刻出した西洋菓子の残りを、紙に包んで私の手に持たせ,西洋菓子,"So saying, she wrapped up the cakes which I had left, and handed them to me.",0.7242237329,,cakes,Particularization,最小化,「西洋菓子」という広範な「西洋風の菓子」を「cakes」と具体的な菓子に置き換え、日本における「西洋」菓子の文化的含意を普遍的な「菓子」に収束（最小化）させている。
879,私はその翌日午飯を食いに学校から帰ってきて、昨夜机の上に載せて置いた菓子の包みを見ると、すぐその中からチョコレートを塗った鳶色のカステラを出して頰張った。,鳶色,"At noon on the next day,  when I returned from school to take lunch, and  looked at the package of cakes on my desk, I at once  attacked one decorated with chocolate.",0.6535353661,,なし,Reduction,否認,訳文では「鳶色」に相当する色情報が完全に削除されており、文化差の存在を否認（無視）している。
885,それまで繻絆というものを着た事のない私が、シャツの上に黒い襟のかかったものを重ねるようになったのはこの時からであった。,繻絆,"It was after that  that I, who had never worn juban 1 before, began to  wear one with a black collar over my shirt.",0.7592012286,juban:A kind of underwear for Japanese kimono.,juban,Amplification,適応,「繻絆」を「juban」と音写し、注釈で機能説明（A kind of underwear for Japanese kimono）を加えることで、読者が役割を機能的に理解できるよう適応している。
914,先生はこの日あたりの好い室の中へ大きな火鉢を置いて、五徳の上に懸けた金盥から立ち上る湯気で、呼吸の苦しくなるのを防いでいた。,五徳,"There was a huge brazier in this sun-lit room, and with the help of the steam  from the basin boiling on it, the sensei was trying to  ease his breathing.",0.6076392531,,なし,Reduction,否認,「五徳」という文化的要素が訳文で完全に削除されており、文化差の存在を否認している。
914,先生はこの日あたりの好い室の中へ大きな火鉢を置いて、五徳の上に懸けた金盥から立ち上る湯気で、呼吸の苦しくなるのを防いでいた。,金盥,"There was a huge brazier in this sun-lit room, and with the help of the steam  from the basin boiling on it, the sensei was trying to  ease his breathing.",0.6076392531,,basin,Generalization,最小化,原文「金盥」の「金」という材質情報を省き「basin」と一般化することで、固有の差異を薄め、湯気を出す容器という普遍的な概念に収束させている。
926,それを奥の茶簞笥か何かの抽出から出して来た奥さんは、白い半紙の上へ鄭寧に重ねて、「そりゃご心配ですね」といった。,茶箪笥,"When she took the bank-notes out of a some cabinet in the back-room, ”O I am very sorry. You must be anxious about your father.”",0.609552443,,some cabinet in the back-room,Generalization,最小化,「茶簞笥」を「some cabinet in the back-room」と訳し、茶道具収納という特定の家具を一般的な「収納家具」に一般化することで、文化差を薄め、共通概念に収束（最小化）させている。
