Location,Note,Highlight_JP,Highlight_EN,注釈
74,先生,私はその人を常に先生と呼んでいた。だからここでもただ先生と書くだけで本名は打ち明けない。これは世間を 憚 かる遠慮というよりも、その方が私にとって自然だからである。私はその人の記憶を呼び起すごとに、すぐ「先生」といいたくなる。,"I never called him anything else, so I will write about him here only as the sensei without mentioning his name, not because of any hesitation in doing so, but simply because the sensei comes naturally to my mind when I think of him.",sensei: A Japanese word for teacher. But even the professors of a university are called sensei by the students.
78,鎌倉,私が先生と知り合いになったのは鎌倉である。,It was in Kamakura that we first met.,
79,書生,その時私はまだ若々しい書生であった。,I was a young student then.,
79,端書,暑中休暇を利用して海水浴に行った友達からぜひ来いという端書を受け取ったので、私は多少の金を工面して、出掛ける事にした。私は金の工面に二、三日を費やした。,"A friend who was staying there during the vacation asked me to come and spend a few days with him, and after waiting two or three days to raise the extra money, I went.",
96,畷,玉突きだのアイスクリームだのというハイカラなものには長い畷を一つ越さなければ手が届かなかった。車で行っても二十銭は取られた。,"We could not reach such fashionable enjoyments as billiards or ice-cream without traversing a long lane between the rice-fields, and it cost twenty sen to go by rickshaw.",
97,二十銭,玉突きだのアイスクリームだのというハイカラなものには長い畷を一つ越さなければ手が届かなかった。車で行っても二十銭は取られた。,"We could not reach such fashionable enjoyments as billiards or ice-cream without traversing a long lane between the rice-fields, and it cost twenty sen to go by rickshaw.",
99,藁葺,私は毎日海へ入りに出掛けた。古い燻ぶり返った藁葺の間を通り抜けて磯へ下りると、この辺にこれほどの都会人種が住んでいるかと思うほど、避暑に来た男や女で砂の上が動いていた。,"Every day I went to the seashore to bathe, going down to the beach between the sootcovered, straw-thatched houses. There were so many people on the sand that one wondered where all the town people stayed.",
99,都会人種,私は毎日海へ入りに出掛けた。古い燻ぶり返った藁葺の間を通り抜けて磯へ下りると、この辺にこれほどの都会人種が住んでいるかと思うほど、避暑に来た男や女で砂の上が動いていた。,"Every day I went to the seashore to bathe, going down to the beach between the sootcovered, straw-thatched houses. There were so many people on the sand that one wondered where all the town people stayed.",
99,避暑,私は毎日海へ入りに出掛けた。古い燻ぶり返った藁葺の間を通り抜けて磯へ下りると、この辺にこれほどの都会人種が住んでいるかと思うほど、避暑に来た男や女で砂の上が動いていた。,"Every day I went to the seashore to bathe, going down to the beach between the sootcovered, straw-thatched houses. There were so many people on the sand that one wondered where all the town people stayed.",
102,銭湯,ある時は海の中が銭湯のように黒い頭でごちゃごちゃしている事もあった。,Sometimes the sea was thronged with black heads like a public bath.,
107,掛茶屋,その時海岸には掛茶屋が二軒あった。私はふとした機会からその一軒の方に行き慣れていた。,"There were two bathing-booths on the shore, but I picked out one of them haphazard and made it my head-quarters.",
123,西洋人,その西洋人の優れて白い皮膚の色が、掛茶屋へ入るや否や、すぐ私の注意を惹いた。,"The moment the exceedingly white skin of that foreigner made its appearance in the booth, my attention was fixed upon him.",
123,掛茶屋,その西洋人の優れて白い皮膚の色が、掛茶屋へ入るや否や、すぐ私の注意を惹いた。,"The moment the exceedingly white skin of that foreigner made its appearance in the booth, my attention was fixed upon him.",
124,浴衣,純粋の日本の浴衣を着ていた彼は、それを床几の上にすぽりと放り出したまま、腕組みをして海の方を向いて立っていた。,"He wore a real Japanese yukata, which he took off and threw upon a bench in a bathhouse. He then crossed his arms and stood facing the sea.",yukata: A kind of kimono worn by men and women in summer.
126,猿股,彼は我々の穿く猿股一つの外何物も肌に着けていなかった。私には～～不思議だった。,"He had nothing on except the short drawers which we wore, and this in itself struck me as strange.",
128,由比ヶ浜,私はその二日前に由井が浜まで行って、砂の上にしゃがみながら、長い間西洋人の海へ入る様子を眺めていた。,"Two days before I had gone to Yuigahama, where I lolled for a long time on the sand, watching foreigners swim.",
135,猿股,そういう有様を目撃したばかりの私の眼には、猿股一つで済まして皆なの前に立っているこの西洋人がいかにも珍しく見えた。,"Fresh from this introduction to foreign methods of bathing, I was surprised at this man's indifference to exposing his body.",
139,手拭い,その日本人は砂の上に落ちた手拭を拾い上げているところであったが、それを取り上げるや否や、すぐ頭を包んで、海の方へ歩き出した。,"The Japanese wrapped his head in the towel as soon as he caught it, and began to walk towards the sea.",
143,遠浅,すると彼らは 真直 に波の中に足を踏み込んだ。そうして遠浅の磯近くにわいわい騒いでいる多人数の間を通り抜けて、比較的広々した所へ来ると、二人とも泳ぎ出した。,"They stepped into the waves at once, and passing through the multitude who were screaming near the shore, went further out to a considerably less crowded part, and began to swim.",
154,麦藁帽,すると西洋人は来ないで先生一人麦藁帽を被ってやって来た。,"This time the sensei came alone, wearing a
straw hat. ",
174,白絣,先生は白絣の上へ兵児帯を締めてから、眼鏡の失くなったのに気が付いたと見えて、急にそこいらを探し始めた。,"It was not until he fastened hekoobi around his shirogasuri yukata that he discovered his loss, and suddenly began to search for them everywhere.",sirogasuri: A kind of cotten cloth.
174,兵児帯,先生は白絣の上へ兵児帯を締めてから、眼鏡の失くなったのに気が付いたと見えて、急にそこいらを探し始めた。,"It was not until he fastened hekoobi¹ around his shirogasuri yukata that he discovered his loss, and suddenly began to search for them everywhere.",hekoobi: A kind of sash
225,鎌倉,しかし帰って二日三日と経つうちに、鎌倉にいた時の気分が段々薄くなって来た。,But two or three days in the city dimmed the glamour of Kamakura.,
238,下女,私はすぐ玄関先を去らなかった。下女の顔を見て少し躊躇してそこに立っていた。,"So I did not turn away at once, but stood looking at the maid's face, hesitating.",
238,名刺,この前名刺を取り次いだ記憶のある下女は、私を待たしておいてまた内へはいった。,"The maid, recognizing me as the visitor of the previous day, left me there and disappeared within the house.",
241,雑司ヶ谷,先生は例月その日になると雑司ヶ谷の墓地にある或る仏へ花を手向けに行く習慣なのだそうである。,She told me politely that the sensei was accustomed to visit a certain grave in Zoshigaya on that day every month.,
241,仏,先生は例月その日になると雑司ヶ谷の墓地にある或る仏へ花を手向けに行く習慣なのだそうである。,She told me politely that the sensei was accustomed to visit a certain grave in Zoshigaya on that day every month.,
248,楓,私は墓地の手前にある苗畠の左側からはいって、両方に楓を植え付けた広い道を奥の方へ進んで行った。するとその端れに見える茶店の中から先生らしい人がふいと出て来た。,"I entered the cemetery from the left-hand side
of the field of young plants in front of it, and proceeded along the wide walk bordered with mapletrees, when suddenly from the farthest extremity a man who looked like the sensei came out of a restingbooth.",
249,茶店,私は墓地の手前にある苗畠の左側からはいって、両方に楓を植え付けた広い道を奥の方へ進んで行った。するとその端れに見える茶店の中から先生らしい人がふいと出て来た。,"I entered the cemetery from the left-hand side
of the field of young plants in front of it, and proceeded along the wide walk bordered with mapletrees, when suddenly from the farthest extremity a man who looked like the sensei came out of a restingbooth.",
266,一切衆生悉有仏生,依撒伯拉何々 の墓だの、 神僕 ロギンの墓だのという 傍 に、 一切衆生悉有仏生 と書いた 塔婆 などが建ててあった。全権公使何々というのもあった。,"Beside the tomb-stones which bore the words a certain so-and-so Isabella's restingplace, or the god's servant Rogin's long home, a stupa stood, on which was written, ""All living things possess the quality of Buddha,"" and I noticed the grave of an ambassador plenipotentiary So-and-so.",
266,塔婆,依撒伯拉何々 の墓だの、 神僕 ロギンの墓だのという 傍 に、 一切衆生悉有仏生 と書いた 塔婆 などが建ててあった。全権公使何々というのもあった。,"Beside the tomb-stones which bore the words a certain so-and-so Isabella's restingplace, or the god's servant Rogin's long home, a stupa stood, on which was written, ""All living things possess the quality of Buddha,"" and I noticed the grave of an ambassador plenipotentiary So-and-so.",
269,墓標,先生はこれらの墓標が現わす人種々の様式に対して、私ほどに滑稽もアイロニーも認めてないらしかった。,"Unlike me, the sensei did not seem to see humour or irony in the way those who had been left behind expressed their grief on those stones.",
274,銀杏,墓地の区切り目に、大きな銀杏が一本空を隠すように立っていた。,"On the border of the walk stood a huge gingko- tree, so tall that it seemed to be hiding the sky.",
276,黄葉,この木がすっかり黄葉して、ここいらの地面は金色の落葉で埋まるようになります,"The leaves turn entirely yellow, and the ground hereabout will be covered with the golden fallen leaves.",
279,鍬,向うの方で凸凹の地面をならして新墓地を作っている男が、鍬の手を休めて私たちを見ていた。,"The man, who was digging the uneven ground to make a new resting-place, stopped his work, and stood looking at us.",
310,小春,私の心は五分と 経たないうちに平素の弾力を回復した。私はそれぎり暗そうなこの雲の影を忘れてしまった。ゆくりなくまたそれを思い出させられたのは、小春の尽きるに間のない或る晩の事であった。,"My heart recovered its usual elasticity in about five
minutes, and after that that shadow never affected
me till one evening at the end of the Indian Summer
when it again oppressed me.",
312,銀杏,先生と話していた私は、ふと先生がわざわざ注意してくれた銀杏の大樹を眼の前に想い浮かべた。,"As I talked with the sensei, there came to my mind the image of the huge gingko-tree to which he had specially attracted my attention.",
317,銀杏,「先生雑司ヶ谷の銀杏はもう散ってしまったでしょうか」,"""Do you think the leaves have fallen from the gingko-tree in Zoshigaya yet?""",
318,空坊主,「まだ空坊主にはならないでしょう」,"""Perhaps it is not entirely bare yet.""",
320,お墓参り,今度お墓参りにいらっしゃる時にお伴をしても宜ござんすか。,May I go with you when you visit the grave ?,
331,雑司ヶ谷,私は忽ち雑司ヶ谷で「先生」と呼び掛けた時の記憶を強く思い起した。,All of a sudden the strong memory of Zoshigaya as I called to the sensei came to me.,
351,座敷,先生と同郷の学生などには時たま座敷で同座する場合もあったが、彼らのいずれもは皆な私ほど先生に親しみをもっていないように見受けられた。,"Once in a while I fell in with some students of his own province, but none of them seemed as friendly with him as I was.",
377,食卓,私は依然として先生に会いに行った。その 内 いつの間にか先生の食卓で 飯 を食うようになった。,"I continued to go to see him, and finally I was sometimes invited to take supper with him, which gave me more opportunities of conversing with his wife.",
393,盃,奥さんは綺麗な眉を寄せて、私の半分ばかり注いで上げた盃を、唇の先へ持って行った。,"Drawing her well-shaped eye-brows together, she held to her lips the cup which I had half filled with saké.",saké: A kind of wine made from rice.
412,天罰,奥さんは黙っていた。「なぜです」と私が代りに聞いた時先生は「天罰だからさ」といって高く笑った。,"His wife was silent. But I asked him to explain what he meant. ""It's our nemesis,""he said, laughing aloud.",
424,箱根,私は箱根から貰った絵端書をまだ持っている。,I still have the picture postcard which he sent to me from Hakone.,
424,端書,私は箱根から貰った絵端書をまだ持っている。,I still have the picture postcard which he sent to me from Hakone.,
425,日光,日光へ行った時は紅葉の葉を一枚封じ込めた郵便も貰った。,"When he went to Nikko, I got a letter from him which contained a maple leaf.",
425,紅葉(もみじ）,日光へ行った時は紅葉の葉を一枚封じ込めた郵便も貰った。,"When he went to Nikko, I got a letter from him which contained a maple leaf.",
429,格子,先生の宅は玄関の次がすぐ座敷になっているので、格子の前に立っていた私の耳にその言逆いの調子だけはほぼ分った。,"As the drawing-room in his house was next to the entrance-hall, my ears could catch the voices clearly enough to detect their sharpness, though I stood outside of the entrance-door.",
437,袴,私は帰ったなりまだ袴を着けていた。私はそれなり表へ出た。,"I still wore my hakama, so I went out at once.",hakama: A kind of kilt worn by students.
438,表へ出た,私は帰ったなりまだ袴を着けていた。私はそれなりすぐ表へ出た。,"I still wore my hakama, so I went out at once.",hakama: A kind of kilt worn by students.
443,魚の骨が喉に刺さった時のように,肴の骨が咽喉に刺さった時のように、私は苦しんだ。,It tortured me like a fish-bone stuck in my throat.,
462,心丈夫,「そういうと、夫の方はいかにも心丈夫のようで少し滑稽だが。,It hardly seems right for me to speak like this.,
489,横浜,先生はその日横浜を出帆する汽船に乗って外国へ行くべき友人を新橋へ送りに行って留守であった。,The sensei had gone out to Shinbashi to see a friend off who was going abroad by the steamer which was to leave Yokohama that day.,
489,新橋,先生はその日横浜を出帆する汽船に乗って外国へ行くべき友人を新橋へ送りに行って留守であった。,The sensei had gone out to Shinbashi to see a friend off who was going abroad by the steamer which was to leave Yokohama that day.,
494,座敷,それで私は座敷へ上がって、先生を待つ間、奥さんと話をした。,So I had a talk with his wife while I waited in his drawing-room.,
504,敬意,だから先生の学問や思想については、先生と密切の関係をもっている私より外に敬意を払うもののあるべきはずがなかった。,"I, who had come into close contact with him, seemed to be the only one who had either knowledge of or respect for his learning or his ideas.",
507,謙遜,私にはその答えが謙遜過ぎてかえって世間を冷評するようにも聞こえた。,"To me that answer was too modest, until I realized that it showed his cold critical attitude toward the world.",
531,東京,奥さんは東京の人であった。それはかつて先生からも奥さん自身からも聞いて知っていた。,I heard from both the sensei and his wife that she was a native of Tokyo.,
533,鳥取,奥さんの父親はたしか鳥取かどこかの出であるのに、お母さんの方はまだ江戸といった時分の市ヶ谷で生れた女なので、奥さんは冗談半分そういったのである。,"I had heard her say in a joking manner that to speak exactly she was half Edokko.For her father had come from Tottori, as I remember, while her mother was born in Ichigaya when Tokyo was still called Edo.",
533,江戸,奥さんの父親はたしか鳥取かどこかの出であるのに、お母さんの方はまだ江戸といった時分の市ヶ谷で生れた女なので、奥さんは冗談半分そういったのである。,"I had heard her say in a joking manner that to speak exactly she was half Edokko.For her father had come from Tottori, as I remember, while her mother was born in Ichigaya when Tokyo was still called Edo.",Edokko: A native of Tokyo.
535,新潟県人,ところが先生は全く方角違いの新潟県人であった。,"But the sensei's home was Niigata, a province far away from either Tottori or Tokyo.",
553,花時分,或る時花時分に私は先生といっしょに上野へ行った。そうしてそこで美しい 一対 の 男女 を見た。,"Once in spring-time I went with him to Ueno, and saw a charming couple walking close together under the cherry-blossoms.",
594,鶯溪,先生と私とは博物館の裏から鶯渓の方角に静かな歩調で歩いて行った。,The sensei and I walked slowly along from the back of the Imperial Museum toward Uguisudani.,
595,垣,垣の隙間から広い庭の一部に茂る熊笹が幽邃に見えた。,"The bamboo clumps covering a part of the garden could be seen through the hedge, looking solitary and mysterious.",
595,幽邃,垣の隙間から広い庭の一部に茂る熊笹が幽邃に見えた。,"The bamboo clumps covering a part of the garden could be seen through the hedge, looking solitary and mysterious.",
595,熊笹,垣の隙間から広い庭の一部に茂る熊笹が幽邃に見えた。,"The bamboo clumps covering a part of the garden could be seen through the hedge, looking solitary and mysterious.",
597,雑司ヶ谷,「君は私がなぜ毎月雑司ヶ谷の墓地に埋っている友人の墓へ参るのか知っていますか」,"""Do you know the reason why I visit my friend's grave in Zoshigaya every month?""",
616,お気の毒,「私はお気の毒に思うのです」,"""I am sorry for you.""",
616,気の毒,「気の毒だが信用されないとおっしゃるんですか」,"""Is it true that you cannot trust me, and perhaps hesitate to say so ?""",
617,椿の花,その庭に、この間まで重そうな赤い強い色をぽたぽた点じていた椿の花はもう一つも見えなかった。,"The camellias, with their heavy strong red, had been in bloom when I was there before, but they were all gone now.",
618,座敷,先生は座敷からこの椿の花をよく眺める癖があった。,The sensei had a habit of looking at them while he was talking in the drawing-room.,
618,椿の花,先生は座敷からこの椿の花をよく眺める癖があった。,The sensei had a habit of looking at them while he was talking in the drawing-room.,
620,生垣,その時生垣の向うで金魚売りらしい声がした。,"As he spoke, a voice which seemed to be a goldfish vendor's was heard from across the hedge.",
620,金魚売り,その時生垣の向うで金魚売りらしい声がした。,"As he spoke, a voice which seemed to be a goldfish vendor's was heard from across the hedge.",
624,針仕事,黙って針仕事か何かしている奥さんの耳に私の話し声が聞こえるという事も知っていた。,"I knew that my words could be plainly heard by his wife, sitting in the next room, busy with needle-work or some other feminine task.",
632,襖の陰で,すると襖の陰で「あなた」という奥さんの声が二度聞こえた。,But just then we heard his wife calling him twice behind the sliding-doors.,
676,秋,その頃は日の詰って行くせわしない秋に、誰も注意を惹かれる肌寒の季節であった。,"It was late autumn, and in these chilly days, no one could be indifferent to the atomosphere of bustle which attended the shortening day.",
676,肌寒い,その頃は日の詰って行くせわしない秋に、誰も注意を惹かれる肌寒の季節であった。,"It was late autumn, and in these chilly days, no one could be indifferent to the atomosphere of bustle which attended the shortening day.",
693,煙草を飲む,私は 畏まったまま 烟草 を飲んでいた。奥さんが茶の間で何か 下女 に話している声が聞こえた。,"I remained in a formal attitude, smoking, and could hear the sensei's wife talking to the maid in the sitting-room.",
694,茶の間,私は 畏まったまま 烟草 を飲んでいた奥さんが茶の間で何か下女に話している声が聞こえた。,"I remained in a formal attitude, smoking, and could hear the sensei's wife talking to the maid in the sitting-room.",
694,下女,私は 畏まったまま 烟草 を飲んでいた。奥さんが茶の間で何か 下女 に話している声が聞こえた。,"I remained in a formal attitude, smoking, and could hear the sensei's wife talking to the maid in the sitting-room.",
700,鹿爪らしく,「おや」といって、軽く驚いた時の眼を私に向けた。そうして客に来た人のように鹿爪らしく控えている私をおかしそうに見た。,"”Why,” she said, looking in, half surprised at me sitting formally like a guest. It seemed to appear ridiculous to her.",
709,長火鉢,私は奥さんの 後 に 尾 いて書斎を出た。茶の間には綺麗な長火鉢に鉄瓶が鳴っていた。,"I followed her to the sitting-room, where an iron tea-kettle was singing pleasantly on a beautifully polished oblong brazier.",
709,鉄瓶,私は奥さんの 後 に 尾 いて書斎を出た。茶の間には綺麗な長火鉢に鉄瓶が鳴っていた。,"I followed her to the sitting-room, where an iron tea-kettle was singing pleasantly on a beautifully polished oblong brazier.",
724,空の盃,空の盃でよくああ飽きずに献酬ができると思いますわ,I wonder why they don’t get tired offering and taking quite empty cups.,
724,献酬,空の盃でよくああ飽きずに献酬ができると思いますわ,I wonder why they don’t get tired offering and taking quite empty cups.,
773,春の雲,けれどもそれは懐かしい春の雲を眺めるような心持で、ただ漠然と夢みていたに過ぎなかった。,"But it was like the feeling which takes possession of us when we look upon the lovely clouds of spring, a mere indefinite longing.",
792,下女部屋,下女部屋 にいる下女はことりとも音をさせなかった。私はまるで泥棒の事を忘れてしまった。,"No sound was heard from the maid in the servant's room, and the thought of the thief had disappeared entirely from my mind.",
798,水注,奥さんは火鉢の灰を 搔 き 馴らした。それから水注の水を鉄瓶に注した。鉄瓶は忽ち鳴りを沈めた。,"She levelled the ashes in the brazier, and poured water into the iron kettle, which stopped singing at once.",
798,鉄瓶,奥さんは火鉢の灰を 搔 き 馴らした。それから水注の水を鉄瓶に注した。鉄瓶は忽ち鳴りを沈めた。,"She levelled the ashes in the brazier, and poured water into the iron kettle, which stopped singing at once.",
858,下女,下女だけは仮寝でもしていたとみえて、ついに出て来なかった。,"The maid did not appear, she must have been dozing in her room.",
871,西洋菓子,奥さんはそういいながら、先刻出した西洋菓子の残りを、紙に包んで私の手に持たせ,"So saying, she wrapped up the cakes which I had left, and handed them to me.",
879,鳶色,私はその翌日午飯を食いに学校から帰ってきて、昨夜机の上に載せて置いた菓子の包みを見ると、すぐその中からチョコレートを塗った鳶色のカステラを出して頰張った。,"At noon on the next day, when I returned from school to take lunch, and looked at the package of cakes on my desk, I at once attacked one decorated with chocolate.",
885,繻絆,それまで繻絆というものを着た事のない私が、シャツの上に黒い襟のかかったものを重ねるようになったのはこの時からであった。,"It was after that that I, who had never worn juban 1 before, began to wear one with a black collar over my shirt.",juban: A kind of underwear for Japanese kimono.
